{
  "schema_version": "medioevo.render_frame_request.v0.1",
  "request_id": "render-frame-001",
  "world_state_ref": "world_state_minimal.json",
  "camera": { "x": 2, "y": 2, "zoom": 1.0, "viewport": [800, 600] },
  "mode": "city_3d",
  "quality_budget": { "memory_tier": "low", "max_lights": 3, "stream_by_camera": true },
  "renderer_capability_ref": "renderer_capability_profile_minimal.json",
  "boundary": { "publication_gate": "BLOCK", "contains_private_data": false, "public_safe": true }
}

